{
  "source": "manual",
  "duration_s": 20.0,
  "display": {
    "width_px": 1920,
    "height_px": 1080,
    "scale": 2.0
  },
  "anchors": [
    {
      "t_s": 2.0,
      "x": 0.3,
      "y": 0.4,
      "button": "left",
      "label": "open"
    },
    {
      "t_s": 8.0,
      "x": 0.8,
      "y": 0.2,
      "button": "left",
      "label": "run"
    }
  ]
}
